{
  "schemaVersion": "1.1.0",
  "ackId": "ack:nightly:2026-09-16:relate",
  "runId": "run:nightly:2026-09-16",
  "stage": "relate",
  "status": "passed",
  "startedAt": "2026-09-16T23:42:56Z",
  "completedAt": "2026-09-16T23:42:56Z",
  "inputs": [
    "interpreted observations"
  ],
  "outputs": [
    "five evidence relationships"
  ],
  "checks": [
    {
      "name": "relationship-evidence",
      "result": "pass"
    }
  ],
  "governance": {
    "allowedTransition": true,
    "approvalRequired": false,
    "boundaryNotes": [
      "explicit edges only"
    ]
  },
  "provenance": {
    "producer": "nightly intelligence automation",
    "method": "evidence relation",
    "inputHashes": [
      "3ac28032bfeec0884353850f5d0cc9c3ca9a8ae5ee6913d943afb0788cf555fe"
    ]
  }
}
