{
  "schemaVersion": "1.1.0",
  "ackId": "ack:nightly:2026-09-14:genesis",
  "runId": "run:nightly:2026-09-14",
  "stage": "genesis",
  "status": "deferred",
  "startedAt": "2026-09-14T23:46:32Z",
  "completedAt": "2026-09-14T23:46:32Z",
  "inputs": [
    "candidate-run"
  ],
  "outputs": [
    "no-genesis-state"
  ],
  "checks": [
    {
      "name": "genesis-transition-blocked",
      "result": "pass"
    }
  ],
  "governance": {
    "allowedTransition": false,
    "approvalRequired": true,
    "boundaryNotes": [
      "Genesis remains human-controlled"
    ]
  },
  "provenance": {
    "producer": "Nightly Consultancy Intelligence & Graph Intake",
    "method": "governance stop",
    "inputHashes": [
      "f33bcbc96677a8d9ddc7b54af77b42c2fc93bea314a647e5f90a8609b251d84b"
    ]
  }
}
