{
  "schemaVersion": "1.1.0",
  "ackId": "ack:nightly:2026-09-17:observe",
  "runId": "run:nightly:2026-09-17",
  "stage": "observe",
  "status": "passed",
  "startedAt": "2026-09-17T23:49:41Z",
  "completedAt": "2026-09-17T23:58:00Z",
  "inputs": [
    "normalized signals"
  ],
  "outputs": [
    "exactly five candidate observations"
  ],
  "checks": [
    {
      "name": "candidate-count",
      "result": "pass",
      "detail": "Exactly five; approvalState=candidate."
    }
  ],
  "governance": {
    "allowedTransition": true,
    "approvalRequired": false,
    "boundaryNotes": [
      "No accepted knowledge created."
    ]
  },
  "provenance": {
    "producer": "Nightly Consultancy Intelligence & Graph Intake",
    "method": "fact/inference separation",
    "inputHashes": [
      "3565d5ae89e8d82fce4bb81dcc5dcb51c97d2e5d0822c9bc337d91ccb4f47101"
    ]
  }
}
