{
  "schemaVersion": "1.1.0",
  "ackId": "ack:nightly-2026-10-02-strategy",
  "runId": "run:nightly:2026-10-02",
  "stage": "strategy",
  "status": "no-change",
  "startedAt": "2026-10-02T19:04:47-04:00",
  "completedAt": "2026-10-02T19:04:47-04:00",
  "inputs": [
    "nightly-window:2026-09-30T19:04:47-04:00/2026-10-02T19:04:47-04:00"
  ],
  "outputs": [
    "observations:5"
  ],
  "checks": [
    {
      "name": "downstream promotion",
      "result": "not-applicable",
      "detail": "Candidate intake may inform strategy/experiment but cannot promote or execute either stage."
    }
  ],
  "governance": {
    "allowedTransition": false,
    "approvalRequired": true,
    "boundaryNotes": [
      "Daily intake cannot accept knowledge or advance Genesis.",
      "Repository actions remain proposals with executed=false."
    ]
  },
  "provenance": {
    "producer": "Nightly Consultancy Intelligence & Graph Intake",
    "method": "48-hour bounded web research + live GitHub authority inspection",
    "inputHashes": [
      "89ee4b3fd8fac4424cd5f1026fafd21bfd4e0b0dab26b7710dede77ce6c283d3"
    ]
  }
}
