{
  "ackId": "ack:genesis:2026-10-05",
  "runId": "run:nightly:2026-10-05",
  "schemaVersion": "1.1.0",
  "stage": "genesis",
  "status": "deferred",
  "startedAt": "2026-10-05T19:33:37-04:00",
  "completedAt": "2026-10-05T19:33:37-04:00",
  "inputs": [
    "input:genesis"
  ],
  "outputs": [
    "output:genesis"
  ],
  "checks": [
    {
      "name": "boundary",
      "result": "not-applicable"
    }
  ],
  "governance": {
    "allowedTransition": false,
    "approvalRequired": true,
    "boundaryNotes": [
      "candidate-only",
      "no promotion"
    ]
  },
  "provenance": {
    "producer": "nightly-intelligence",
    "method": "strict-48h research + live authority preflight",
    "inputHashes": [
      "hash:genesis"
    ]
  }
}
