{
  "schemaVersion": "1.1.0",
  "ackId": "ack:nightly:2026-09-09:interpret",
  "runId": "run:nightly:2026-09-09",
  "stage": "interpret",
  "status": "passed",
  "startedAt": "2026-09-09T23:34:06Z",
  "completedAt": "2026-09-09T23:34:06Z",
  "inputs": [
    "nightly:interpret:input"
  ],
  "outputs": [
    "nightly:interpret:output"
  ],
  "checks": [
    {
      "name": "contract",
      "result": "pass"
    }
  ],
  "governance": {
    "allowedTransition": true,
    "approvalRequired": false,
    "boundaryNotes": [
      "candidate-only"
    ]
  },
  "provenance": {
    "producer": "Nightly Consultancy Intelligence & Graph Intake",
    "method": "48h research + GitHub watch + live preflight",
    "inputHashes": [
      "5cab58bb0830b8fb47ace2a77d3443d3eac7b0c82ea45ed33948af955707312d"
    ]
  }
}
