{
  "ackId": "ack:nightly:2026-09-20:genesis",
  "runId": "run:nightly:2026-09-20",
  "stage": "genesis",
  "status": "deferred",
  "startedAt": "2026-09-20T07:30:00Z",
  "completedAt": "2026-09-20T07:30:00Z",
  "inputs": [
    "candidate-only"
  ],
  "outputs": [],
  "checks": [
    {
      "name": "genesis-blocked",
      "result": "pass"
    }
  ],
  "governance": {
    "allowedTransition": false,
    "approvalRequired": true,
    "boundaryNotes": [
      "Genesis advancement prohibited"
    ]
  },
  "provenance": {
    "producer": "ChatGPT nightly intelligence",
    "method": "defer",
    "inputHashes": [
      "sha256:source-set-2026-09-20"
    ]
  },
  "schemaVersion": "1.1.0"
}
